{
  "$schema": "https://json-schema.org/draft/2020-12/schema",
  "$id": "https://swarmedge.local/schema/manifest-v1.json",
  "title": "SwarmEdge CDN Manifest v1",
  "type": "object",
  "additionalProperties": false,
  "required": [
    "schemaVersion",
    "productId",
    "version",
    "fileName",
    "fileSize",
    "chunking",
    "chunks",
    "createdAt",
    "expiresAt",
    "sequence",
    "signingKeyId",
    "signature"
  ],
  "properties": {
    "schemaVersion": { "type": "integer", "const": 1 },
    "productId": { "type": "string", "minLength": 1 },
    "version": { "type": "string", "minLength": 1 },
    "fileName": { "type": "string", "minLength": 1 },
    "fileSize": { "type": "integer", "minimum": 0 },
    "chunking": {
      "type": "object",
      "additionalProperties": false,
      "required": ["mode", "chunkSize"],
      "properties": {
        "mode": { "type": "string", "const": "FIXED" },
        "chunkSize": { "type": "integer", "minimum": 1 }
      }
    },
    "chunks": {
      "type": "array",
      "items": {
        "type": "object",
        "additionalProperties": false,
        "required": ["index", "offset", "length", "sha256"],
        "properties": {
          "index": { "type": "integer", "minimum": 0 },
          "offset": { "type": "integer", "minimum": 0 },
          "length": { "type": "integer", "minimum": 1 },
          "sha256": { "type": "string", "pattern": "^[0-9a-f]{64}$" }
        }
      }
    },
    "createdAt": { "type": "string", "pattern": "^\\d{4}-\\d{2}-\\d{2}T\\d{2}:\\d{2}:\\d{2}Z$" },
    "expiresAt": { "type": "string", "pattern": "^\\d{4}-\\d{2}-\\d{2}T\\d{2}:\\d{2}:\\d{2}Z$" },
    "sequence": { "type": "integer", "minimum": 0 },
    "signingKeyId": { "type": "string", "minLength": 1 },
    "signature": { "type": "string", "minLength": 1 }
  }
}
