{"schemaVersion":1,"productId":"game-x","version":"1.4.0","fileName":"game-x-1.4.0.bin","fileSize":8,"chunking":{"mode":"FIXED","chunkSize":4194304},"chunks":[{"index":0,"offset":0,"length":8,"sha256":"e3b0c44298fc1c149afbf4c8996fb92427ae41e4649b934ca495991b7852b855"}],"createdAt":"2026-08-12T00:00:00Z","expiresAt":"2026-09-12T00:00:00Z","sequence":17,"signingKeyId":"release-key-2026-01","signature":"dGVzdHNpZw=="}
